{
  "schema_version": "vivi-source-catalog-entry/v1",
  "source_id": "miracl-vietnamese-official",
  "title": "MIRACL Vietnamese official corpus and topics",
  "catalog_status": "research-backlog",
  "registry_status": "legal-hold",
  "origin": {
    "locator": "https://github.com/project-miracl/miracl",
    "revision": "unfetched-exact-release-pending",
    "access": "public-or-gated"
  },
  "selectors": null,
  "bindings": [],
  "declared_license": "artifact-specific-review-required",
  "evidence_refs": [],
  "source_register_snapshot": {
    "source_id": "miracl-vietnamese-official",
    "version": "candidate-2026-07-28",
    "title": "MIRACL Vietnamese official corpus and topics",
    "status": "legal-hold",
    "source_type": "public-dataset",
    "locator": "https://github.com/project-miracl/miracl",
    "source_revision": "unfetched-exact-release-pending",
    "upstream_checksum_sha256": null,
    "proposed_purposes": ["retrieval-evaluation"],
    "classification": "public",
    "owner_role": "data-owner",
    "rights": {
      "license_id": "artifact-specific-review-required",
      "commercial_use": "unknown",
      "derivatives": "unknown",
      "redistribution": "unknown",
      "access_conditions": "Pin official artifact and review corpus-specific rights before fetch.",
      "evidence_urls": ["https://github.com/project-miracl/miracl"],
      "legal_review": "pending"
    },
    "retention": {
      "policy_id": "public-source-candidate-v1",
      "duration_days": 90
    },
    "deletion_method": "Delete candidate/quarantine artifacts and tombstone lineage.",
    "review_date": "2026-08-28",
    "notes": "Priority 2 retrieval benchmark candidate; never VinFast knowledge."
  },
  "provenance": {
    "legacy_entry_superseded": false,
    "catalog_origin": "legacy-public-source-register",
    "migration_evidence_ref": "evidence-index:public-intake-checkpoints#public-fetch-security-checkpoint",
    "quarantine_observation": "not-observed"
  }
}
