{
  "schema_version": "vivi-source-catalog-entry/v1",
  "source_id": "miracl-vietnamese-derived-triplets",
  "title": "MIRACL Vietnamese-derived triplets",
  "catalog_status": "research-backlog",
  "registry_status": "legal-hold",
  "origin": {
    "locator": "https://huggingface.co/datasets/nlpai-lab/miracl-multilingual-triplets",
    "revision": "unfetched-candidate",
    "access": "public-or-gated"
  },
  "selectors": null,
  "bindings": [],
  "declared_license": "unverified-third-party-translation",
  "evidence_refs": [],
  "source_register_snapshot": {
    "source_id": "miracl-vietnamese-derived-triplets",
    "version": "candidate-2026-07-23",
    "title": "MIRACL Vietnamese-derived triplets",
    "status": "legal-hold",
    "source_type": "public-dataset",
    "locator": "https://huggingface.co/datasets/nlpai-lab/miracl-multilingual-triplets",
    "source_revision": "unfetched-candidate",
    "upstream_checksum_sha256": null,
    "proposed_purposes": ["retrieval-evaluation"],
    "classification": "public",
    "owner_role": "data-owner",
    "rights": {
      "license_id": "unverified-third-party-translation",
      "commercial_use": "unknown",
      "derivatives": "unknown",
      "redistribution": "unknown",
      "access_conditions": "Third-party translation; cần xác minh upstream rights và translation quality.",
      "evidence_urls": [
        "https://huggingface.co/datasets/nlpai-lab/miracl-multilingual-triplets"
      ],
      "legal_review": "pending"
    },
    "retention": {
      "policy_id": "public-source-candidate-v1",
      "duration_days": 90
    },
    "deletion_method": "Xóa candidate metadata/artifact và tombstone lineage.",
    "review_date": "2026-08-23",
    "notes": "Chưa download; cần quality và Legal review."
  },
  "provenance": {
    "legacy_entry_superseded": false,
    "catalog_origin": "legacy-public-source-register",
    "migration_evidence_ref": "evidence-index:public-intake-checkpoints#public-fetch-security-checkpoint",
    "quarantine_observation": "not-observed"
  }
}
