{
  "schema_version": "vivi-source-catalog-entry/v1",
  "source_id": "mkqa",
  "title": "MKQA",
  "catalog_status": "research-backlog",
  "registry_status": "legal-hold",
  "origin": {
    "locator": "https://huggingface.co/datasets/apple/mkqa/tree/main",
    "revision": "main-unfetched",
    "access": "public-or-gated"
  },
  "selectors": null,
  "bindings": [],
  "declared_license": "conflicting-cc-by-3.0-vs-cc-by-sa-3.0",
  "evidence_refs": [],
  "source_register_snapshot": {
    "source_id": "mkqa",
    "version": "candidate-2026-07-23",
    "title": "MKQA",
    "status": "legal-hold",
    "source_type": "public-dataset",
    "locator": "https://huggingface.co/datasets/apple/mkqa/tree/main",
    "source_revision": "main-unfetched",
    "upstream_checksum_sha256": null,
    "proposed_purposes": [
      "retrieval-evaluation"
    ],
    "classification": "public",
    "owner_role": "data-owner",
    "rights": {
      "license_id": "conflicting-cc-by-3.0-vs-cc-by-sa-3.0",
      "commercial_use": "unknown",
      "derivatives": "unknown",
      "redistribution": "unknown",
      "access_conditions": "Dataset card và loader cũ ghi khác nhau về ShareAlike; Legal phải xác minh upstream license, notice và derived artifact.",
      "evidence_urls": [
        "https://huggingface.co/datasets/apple/mkqa/tree/main",
        "https://huggingface.co/datasets/apple/mkqa/blob/main/mkqa.py"
      ],
      "legal_review": "pending"
    },
    "retention": {
      "policy_id": "public-source-candidate-v1",
      "duration_days": 90
    },
    "deletion_method": "Xóa candidate artifact và tombstone source revision.",
    "review_date": "2026-08-23",
    "notes": "Open-domain benchmark, không phải nguồn fact VinFast.",
    "origin": {
      "kind": "external-https",
      "requested_uri": "https://huggingface.co/datasets/apple/mkqa/tree/main",
      "allowed_origin": "https://huggingface.co/"
    },
    "allowed_origin": "https://huggingface.co/"
  },
  "provenance": {
    "legacy_entry_superseded": false,
    "catalog_origin": "legacy-public-source-register",
    "migration_evidence_ref": "evidence-index:public-intake-checkpoints#public-fetch-security-checkpoint",
    "quarantine_observation": "not-observed"
  }
}
